{
  "id": "photoshop",
  "name": "Adobe Photoshop",
  "vendor": "Adobe",
  "category": "image-editing",
  "officialUrl": "https://www.adobe.com/products/photoshop.html",
  "pricingModel": "subscription",
  "platforms": ["Windows", "macOS", "iPad"],
  "trademarkStatus": "reviewed",
  "reviewStatus": "approved",
  "aiGenerated": false,
  "metadata": {
    "created": "2026-07-19",
    "updated": "2026-07-19"
  },
  "_meta": {
    "source": "official-website",
    "schema_version": "1.0.0",
    "unverified_fields": [],
    "confidence": "high"
  }
}
